{
  "design_route": "single_time_observational",
  "estimand": "ate",
  "treatment_type": "binary",
  "outcome_type": "continuous",
  "nuisance_complexity": "moderate",
  "positivity_status": "limited",
  "confounder_status": "strong",
  "needs_cross_fitting": true,
  "needs_inference": true,
  "sample_size": 2500,
  "n_covariates": 40,
  "clustered": false,
  "censoring_or_missingness": "limited",
  "language": "either"
}
